id,question,choice1,choice2,choice3,choice4,explanation,img,category
1-1,令和4年の日本の出産数に最も近いのはどれか,７７万人,５７万人,９７万人,１１７万人,正解：７７万人\n令和４年度の人口動態統計によると日本の出生数は７７万７５９人であり明治３２年の人口動態調査開始以来最少となった。第１１４回全国公開模擬試験にあります。,img/1-1.png,必修
1-2,令和元年の国民健康・栄養調査における１日の平均睡眠時間で最も多いのはどれか,6時間以上7時間未満,5時間未満,8時間以上9時間未満,9時間以上,正解：6時間以上7時間未満\n令和元年度の国民健康・栄養調査によると1日平均睡眠時間は6時間以上7時間未満の割合が最も高く男性32.7％、女性は36.2％です。第１１４回全国公開模擬試験にあります。,img/1-2.png,必修
1-3,仕事と生活の調和憲章で正しいのはどれか,多様な生き方が選択・実現できる社会を目指している,女性の社会進出を促進するために策定された,パートタイム労働者については言及していない,厚生労働省により提案された,正解：多様な生き方が選択・実現できる社会を目指している\nワークライフバランスは内閣府が推進していいます。姓や年齢などにかかわらず、だれもが自らの意欲と能力を持って様々な働き方や生き方に挑戦できるよう推定されました。短時間労働者及び有期雇用労働者の雇用管理の改善等に関する法律など、パートタイム労働者の働き方について改善策も展開しています。関係閣僚、経済界、労働界、地方公共団体の代表等から構成される仕事と生活の調和推進官民トップ会議において策定されました。第１１４回全国公開模擬試験にあります。,img/1-3.png,必修
1-4,介護保険で正しいのはどれか,要介護1は介護給付の対象となる,65歳以上の実が給付を受けられる,在宅の改修は給付されない,要支援2は介護給付の対象となる,正解：要介護1は介護給付の対象となる\n介護保険は40歳以上65歳未満の第二号被保険者は海嶺に伴う疾病が原因で要介護・要支援認定を受けた場合、給付の対象となります。一定の条件を満たす要介護・要支援者の住宅改修に給付されます。要支援1～2は予防給付の対象となります。要介護1～5は介護きゅふの対象となります。第１１４回全国公開模擬試験にあります。,img/1-4.png,必修
1-5,大泉門が閉鎖する時期はどれか,1歳6か月頃,2～3か月頃,6か月頃,2～3歳頃,正解：1歳6か月頃\n大泉門は初めの数か月は増大するがその後は収縮して1歳6か月頃までは閉鎖します。第１１４回全国公開模擬試験にあります。,img/1-5.png,必修
1-6,令和4年度の全国体力・運動習慣等調査の結果で正しいのはどれか,ちょう座体前屈は男女ともに向上した,体力合計点は男女ともに上昇した,肥満の割合は男女ともに低下した,上体起こしは男女ともに向上した,正解：長座体前屈は男女ともに向上した\n体力合計点は令和元年度調査から連続して小中学生男女ともに低下しました。小中学生の男女ともに肥満の割合は増加しています。上体起こしの能力は低下しています。第１１４回全国公開模擬試験にあります。,img/1-6.png,必修
1-7,疾病が患者・家族に与える心理・社会影響の説明で適切なのはどれか,患者の回復意欲は家族のかかわり方により変化する,患者の疾病のとらえ方はどの家族でも同じである,家族の1人が健康を害したとき他の家族の役割に変化はしない,経済的負担は影響しない,正解：患者の回復意欲は家族のかかわり方により変化する\n家族の一人が健康を害したとき価値観や生活様式の違う各各の家族によってその疾病のとらえ方は異なり、家族は援助や介護をする役割が増え家族間での役割交代が生じる可能性があります。家族の一人が健康を害したとき入院費、治療費など患者にかかる費用だけでなく、患者を取り巻く家族の経済的な負担も派生し、心理社会的にも影響を与える。第１１４回全国公開模擬試験にあります。,img/1-7.png,必修
1-8,細胞性免疫で正しいのはどれか,Ｔ細胞が関与する,Ｂ細胞が関与する,免疫抗体と補体が関与する,直ちに非自己の排除が行われる,正解：T細胞が関与する\n細胞性免疫は細胞の内に入り込んだ病原体そのものやウイルス感染細胞、がん細胞などの異物として排除サウル免疫機構で細胞傷害性T細胞やマクロファージなどが行う。体液中に放出された抗体や保体による異物の排除は液性免疫といいます。B細胞は液性免疫に関与します。免疫抗体は液性免疫です。直ちに免疫反応が起こるのは液性免疫です。第１１４回全国公開模擬試験にあります。,img/1-8.png,必修
1-9,排尿時に収縮するのはどれか,排尿筋,内尿道括約筋,外尿道括約筋,尿管,正解：排尿筋\n排尿時、は内・外尿道括約筋は弛緩します。尿管は平滑筋からなる長さ20～30ｃｍの管です。尿は尿管の平滑筋の蠕動運動によって膀胱へと移動します。第１１４回全国公開模擬試験にあります。,img/1-9.png,必修
1-10,脳死半手にに必要な検査はどれか,脳波検査,聴覚検査,心電図検査,筋電図検査,正解：脳波検査\n脳死の判断は瞳孔の散大、脳幹反射消失、無呼吸などが対象となり、二回の判定が行われます。第１１４回全国公開模擬試験にあります。,img/1-10.png,必修
1-11,吐血の主な特徴はどれか,酸性である,肺や気管支などから出血が要因である,神経原性ショックに陥る,喀痰を伴う,正解：酸性である\n肺や気管支からの出血、咳嗽は喀血の症状です。吐血は上部消化管からの出血です。大量に血液を履いた場合は循環血液減少性ショックに陥る可能性があります。第１１４回全国公開模擬試験にあります。,img/1-11.png,必修
1-12,リズム不整があるのはどれか,3度房室ブロック,ペースメーカーを挿入している状態,洞性頻脈,洞性徐脈,正解：3度房室ブロック\nペースメーカーは洞調律を司ります。洞調律で心拍数が100回/分以上を洞性頻脈、60回/分未満を洞性徐脈といいます。第１１４回全国公開模擬試験にあります。,img/1-12.png,必修



2-1,骨の構造と機能で正しいのはどれか,緻密室には骨の趙軸方向に走るハバース管がある,黄色骨髄は造血を行う,骨内には血管や神経はない,成人では長管骨にのみ造血機能がある,正解：緻密室には骨の趙軸方向に走るハバース管がある\n骨辞意は海面室及び髄注の隙間を満たしています。骨髄のうち造血機能のあるものを赤色骨髄といい黄色骨髄は脂肪に富むため造血機能はありません。新生児ではすべての骨髄が赤色骨髄であるが、そのほとんどは年齢とともに造血機能を失い成人の赤色骨髄は胸骨や椎骨など一部の骨にのみ残ります。第１１４回全国公開模擬試験にあります。,img/2-1.png,人体

3-1,モルヒネの副作用で正しいのはどれか,呼吸抑制,易感染傾向,高血糖,第８脳神経障害,正解：呼吸抑制\n易感染傾向や高血糖はステロイド性抗炎症薬などで見られる副作用です。第８脳神経障害はアミノグリコシド系抗菌薬で見られる副作用です。モルヒネの副作用には呼吸抑制のほかに悪心、嘔吐、便秘などがあります。第１１４回全国公開模擬試験にあります。,img/3-1.png,疾病

4-1,ノーマライゼーションの理念に最も近いのはどれか,高齢者、障碍者等の移動等の円滑化の促進に関する法律,健康日本21,がん対策推進基本計画,トータルヘルスプロモーションプラン,正解：高齢者、障碍者等の移動等の円滑化の促進に関する法律\nノーマライゼーションとは障害者や高齢者など社会的に不利になりやすい人がほかの人と同じように生活し、活動する社会が正常な姿であるとする考え方です。様々な法律に反映されています。健康日本21は、国民の健康を守り、生活の質を高めるための基本計画です。がん対策推進基本計画はがんの予防・早期発見・治療を目的としています。トータルヘルスプロモーションプランは、健康と福祉を総合的に推進する計画です。第１１４回全国公開模擬試験にあります。,img/4-1.png,社会

5-1,健康の概念で正しいのはどれか,障害を持っていてもその人なりの健康がある,地域や文化による影響は少ない,健康と不健康とは不連続である,身体的健康が最も重要である,正解：障害を持っていてもその人なりの健康がある\nＷＨＯでは健康とは身体的・精神的及び社会的に完全に安寧を保っている状態をいうのであって単に病気や虚弱でないことではないと唱えられています。地域や文化が変われば健康の概念も変わります。健康と不健康ははっきり区別できず、連続的な関係です。第１１４回全国公開模擬試験にあります。,img/5-1.png,基礎

6-1,成人の身体的特徴で正しいのはどれか,40歳ころから目の遠近調節機能の低下を自覚する,女性では20歳代から骨量が急激に減少する,結晶性知能は25歳ごろをピークにその後徐々に低下する,胸腺は加齢とともに肥大する,正解：40歳ころから目の遠近調節機能の低下を自覚する\n女性は閉経後にエストロゲンが関係し骨量が急激に減少します。結晶性知能は経験の積み重なにより向上し高齢になっても維持されるといわれます。流動性知能は加齢に伴い低下します。胸腺の重量は思春期をピークにその後は徐々に減少し、成人期では萎縮が進行します。第114回全国公開模擬試験にあります。,img/6-1.png,成人

7-1,手段的日常生活動作に含まれるのはどれか,家事,入浴,整容,排泄,正解：家事\n手段的日常生活動作とは日常生活を起こるために必要な高次動作を指します。具体的には買い物洗濯料理などの家事全般から金銭管理、服薬管理、交通機関の利用などがあげられます。更衣、整容、入浴、食事、排泄などは基本的日常生活動作に該当します。第１１４回全国公開模擬試験にあります。,img/7-1.png,老年

8-1,朝になると「頭が痛い」「調子が悪い」といい３０日以上学校を休み続けている小学６年生の子供に対する母親の対応として適切なのはどれか,子供に対する愛情を伝え見守りを励ましていく,学校にいけない理由を問い詰める,登校する気になるまでかかわりを避ける,勉強で役立つ動画やテレビを毎日見させる,正解：子どっもに対する愛情を伝え見守り励ましていく\n文部科学省では「何らかの心理的、情緒的、身体的あるいは社会的要因・背景により登校しないあるいはしたくともできない状況にあるために年間30日以上欠席したもののうち、病気や経済的な理由によるものを除いたもの」を不登校生徒と定義しています。不登校になるきっかけは、友人関係、学業、家庭環境、学校や社会とのかかわりにおける問題など様々なものがあり、単一ではなく複数の理由によるものが多いです。また近点では怠学や無気力などが要因で「悩んでいない」不登校も増加しています。不登校児へのかかわりで大切なのは子供に対して愛情をもって接し、学校等と密に連絡を取りながら温かく見守っていくことです。また、スクールカウンセラーへの相談や地域の適応指導教室の活用も検討します。第１１４回全国公開模擬試験にあります。,img/8-1.png,小児

9-1,ルービン．Ｒにより提唱された母親への育児技術の伝達に適している時期はどれか,産褥2・3日～10日ごろ,産褥0日ごろ,産褥1～2日ごろ,産褥10以降,正解：産褥2・3日～10日ごろ\n母親として適応していく過程はルービンによって3つの段階が提唱されていおり、それぞれの時期の応じたサポートが必要である。育児技術の伝達に適した時期は保守期であり産褥2・3日～10日ごろです。第１１４回全国公開模擬試験にあります。,img/9-1.png,小児

10-1,危機介入で正しいのはどれか,患者の感情表出を促す,患者の新たなコーピング行動の習得は不要である,長期的な援助方法を主とする,人的資源の活用は含まない,正解：患者の感情表出を促す\n危機介入とは現在危機状態にある人々への問題解決に働きかけ、短期的・即応的・集中的にアプローチし、患者自身が問題を解決するための新しい対応能力を獲得し成長していけるよう援助することです。第１１４回全国公開模擬試験にあります。,img/10-1.png,精神

11-1,訪問看護利用者の個人情報の取り扱いについて訪問看護師の対応で最も適切なのはどれか,連携する各所で個人情報を相互に利用する場合は利用者の許可を得る,隣人に利用者の家族状況を伝えて協力を依頼する,宅配行者に利用者の病名を伝えて配慮を依頼する,訪問看護報告書を市町村に提出する,正解：連携する各所で個人情報を相互利用する場合は利用者の承諾を得る\nインフォーマルサポートとして近隣住民の協力が必要な場合もあるが個人情報の第3社への提供には原則として本人の同意が必要です。利用者の病名を第三者に伝えてはいけません。訪問看護報告書は主治医に提出します。第１１４回全国公開模擬試験にあります。,img/11-1.png,在宅

12-1,看護マネジメントのプロセスで業務評価や情報処理労務管理を行うことに該当するのはどれか,統制,計画,組織化,指揮,正解：統制\n看護マネジメントは計画、組織化、指揮、統制の順に行われます。第１１４回全国公開模擬試験にあります。,img/12-1.png,統合
